Sheet: Inventory
A1: id | B1: name | C1: price | D1: count | E1: amount
A2: 1 | B2: =VLOOKUP(RC[-1],Product!R2C1:R21C3,2,FALSE) -> エアコン | C2: =VLOOKUP(RC[-2],Product!R2C1:R21C3,3,FALSE) -> 19800 | D2: 3 | E2: =RC[-2]*RC[-1] -> 59400
A3: =Product!RC -> 2 | B3: =VLOOKUP(RC[-1],Product!R2C1:R21C3,2,FALSE) -> 扇風機 | C3: =VLOOKUP(RC[-2],Product!R2C1:R21C3,3,FALSE) -> 15000 | D3: 2 | E3: =RC[-2]*RC[-1] -> 30000
A4: =Product!RC -> 3 | B4: =VLOOKUP(RC[-1],Product!R2C1:R21C3,2,FALSE) -> 空気清浄機 | C4: =VLOOKUP(RC[-2],Product!R2C1:R21C3,3,FALSE) -> 18400 | D4: 3 | E4: =RC[-2]*RC[-1] -> 55200
A5: =Product!RC -> 4 | B5: =VLOOKUP(RC[-1],Product!R2C1:R21C3,2,FALSE) -> 加湿器 | C5: =VLOOKUP(RC[-2],Product!R2C1:R21C3,3,FALSE) -> 12900 | D5: 4 | E5: =RC[-2]*RC[-1] -> 51600
A6: =Product!RC -> 5 | B6: =VLOOKUP(RC[-1],Product!R2C1:R21C3,2,FALSE) -> 除湿機 | C6: =VLOOKUP(RC[-2],Product!R2C1:R21C3,3,FALSE) -> 7400 | D6: 1 | E6: =RC[-2]*RC[-1] -> 7400
A7: =Product!RC -> 6 | B7: =VLOOKUP(RC[-1],Product!R2C1:R21C3,2,FALSE) -> 冷蔵庫 | C7: =VLOOKUP(RC[-2],Product!R2C1:R21C3,3,FALSE) -> 11900 | D7: 2 | E7: =RC[-2]*RC[-1] -> 23800
A8: =Product!RC -> 7 | B8: =VLOOKUP(RC[-1],Product!R2C1:R21C3,2,FALSE) -> 冷凍庫 | C8: =VLOOKUP(RC[-2],Product!R2C1:R21C3,3,FALSE) -> 5300 | D8: 6 | E8: =RC[-2]*RC[-1] -> 31800
A9: =Product!RC -> 8 | B9: =VLOOKUP(RC[-1],Product!R2C1:R21C3,2,FALSE) -> 洗濯機 | C9: =VLOOKUP(RC[-2],Product!R2C1:R21C3,3,FALSE) -> 18800 | D9: 6 | E9: =RC[-2]*RC[-1] -> 112800
A10: =Product!RC -> 9 | B10: =VLOOKUP(RC[-1],Product!R2C1:R21C3,2,FALSE) -> 掃除機 | C10: =VLOOKUP(RC[-2],Product!R2C1:R21C3,3,FALSE) -> 5100 | D10: 3 | E10: =RC[-2]*RC[-1] -> 15300
A11: =Product!RC -> 10 | B11: =VLOOKUP(RC[-1],Product!R2C1:R21C3,2,FALSE) -> 炊飯器 | C11: =VLOOKUP(RC[-2],Product!R2C1:R21C3,3,FALSE) -> 8600 | D11: 6 | E11: =RC[-2]*RC[-1] -> 51600
A12: =Product!RC -> 11 | B12: =VLOOKUP(RC[-1],Product!R2C1:R21C3,2,FALSE) -> オーブンレンジ | C12: =VLOOKUP(RC[-2],Product!R2C1:R21C3,3,FALSE) -> 17500 | D12: 8 | E12: =RC[-2]*RC[-1] -> 140000
A13: =Product!RC -> 12 | B13: =VLOOKUP(RC[-1],Product!R2C1:R21C3,2,FALSE) -> 電子レンジ | C13: =VLOOKUP(RC[-2],Product!R2C1:R21C3,3,FALSE) -> 16400 | D13: 5 | E13: =RC[-2]*RC[-1] -> 82000
A14: =Product!RC -> 13 | B14: =VLOOKUP(RC[-1],Product!R2C1:R21C3,2,FALSE) -> 電動アシスト自転車 | C14: =VLOOKUP(RC[-2],Product!R2C1:R21C3,3,FALSE) -> 6100 | D14: 2 | E14: =RC[-2]*RC[-1] -> 12200
A15: =Product!RC -> 14 | B15: =VLOOKUP(RC[-1],Product!R2C1:R21C3,2,FALSE) -> コーヒーメーカー | C15: =VLOOKUP(RC[-2],Product!R2C1:R21C3,3,FALSE) -> 10100 | D15: 5 | E15: =RC[-2]*RC[-1] -> 50500
A16: =Product!RC -> 15 | B16: =VLOOKUP(RC[-1],Product!R2C1:R21C3,2,FALSE) -> オーブントースター | C16: =VLOOKUP(RC[-2],Product!R2C1:R21C3,3,FALSE) -> 15400 | D16: 9 | E16: =RC[-2]*RC[-1] -> 138600
A17: =Product!RC -> 16 | B17: =VLOOKUP(RC[-1],Product!R2C1:R21C3,2,FALSE) -> ホットプレート | C17: =VLOOKUP(RC[-2],Product!R2C1:R21C3,3,FALSE) -> 2300 | D17: 5 | E17: =RC[-2]*RC[-1] -> 11500
A18: =Product!RC -> 17 | B18: =VLOOKUP(RC[-1],Product!R2C1:R21C3,2,FALSE) -> ホットサンドメーカー | C18: =VLOOKUP(RC[-2],Product!R2C1:R21C3,3,FALSE) -> 15500 | D18: 2 | E18: =RC[-2]*RC[-1] -> 31000
A19: =Product!RC -> 18 | B19: =VLOOKUP(RC[-1],Product!R2C1:R21C3,2,FALSE) -> アイスクリームメーカー | C19: =VLOOKUP(RC[-2],Product!R2C1:R21C3,3,FALSE) -> 3700 | D19: 8 | E19: =RC[-2]*RC[-1] -> 29600
A20: =Product!RC -> 19 | B20: =VLOOKUP(RC[-1],Product!R2C1:R21C3,2,FALSE) -> ヨーグルトメーカー | C20: =VLOOKUP(RC[-2],Product!R2C1:R21C3,3,FALSE) -> 200 | D20: 1 | E20: =RC[-2]*RC[-1] -> 200
A21: =Product!RC -> 20 | B21: =VLOOKUP(RC[-1],Product!R2C1:R21C3,2,FALSE) -> ワッフルメーカー | C21: =VLOOKUP(RC[-2],Product!R2C1:R21C3,3,FALSE) -> 18600 | D21: 3 | E21: =RC[-2]*RC[-1] -> 55800

Sheet: Product
A1: id | B1: name | C1: price
A2: 1 | B2: エアコン | C2: 19800
A3: 2 | B3: 扇風機 | C3: 15000
A4: 3 | B4: 空気清浄機 | C4: 18400
A5: 4 | B5: 加湿器 | C5: 12900
A6: 5 | B6: 除湿機 | C6: 7400
A7: 6 | B7: 冷蔵庫 | C7: 11900
A8: 7 | B8: 冷凍庫 | C8: 5300
A9: 8 | B9: 洗濯機 | C9: 18800
A10: 9 | B10: 掃除機 | C10: 5100
A11: 10 | B11: 炊飯器 | C11: 8600
A12: 11 | B12: オーブンレンジ | C12: 17500
A13: 12 | B13: 電子レンジ | C13: 16400
A14: 13 | B14: 電動アシスト自転車 | C14: 6100
A15: 14 | B15: コーヒーメーカー | C15: 10100
A16: 15 | B16: オーブントースター | C16: 15400
A17: 16 | B17: ホットプレート | C17: 2300
A18: 17 | B18: ホットサンドメーカー | C18: 15500
A19: 18 | B19: アイスクリームメーカー | C19: 3700
A20: 19 | B20: ヨーグルトメーカー | C20: 200
A21: 20 | B21: ワッフルメーカー | C21: 18600